{"algorithm":"marrs-rover-merkle.1","demoLabel":"Demo data — not VT Infinite's financial records.","entityId":"demo","environment":"synthetic-demo","leafCount":"24","periodId":"2000-Q1","proofs":[{"eventId":"32c80aaf-039c-4958-a8d4-bee7d6b5b511","eventSequence":"1","leaf":"707daa82ef564fd055e2f958f05f78d1a9f75cec05700cc8897ec471f7c53663","leafIndex":"0","path":[{"hash":"0243271e292530a1de4c1d3a55a921fc322ad0f39ef2c33c5f47cf1c3c939c71","side":"right"},{"hash":"433ac293dc07fa907175e75567348b72af1497a06ba479de31c4a197ea480902","side":"right"},{"hash":"4e93e24678dc9c60ced9c74161d4dbc12259103a432465a7e3d1773039a4bef7","side":"right"},{"hash":"b3d38157a9a150679d3b9bc66985b68e6e377aadeeb0fc241cd93e81e3e91e3f","side":"right"},{"hash":"46ab0e92e398fb326acaa32ceecc6979e7c6c20308e7578e260c35f83d10d27f","side":"right"}]},{"eventId":"09c8f0ae-1f27-49ef-8e7c-76879003f7b1","eventSequence":"2","leaf":"0243271e292530a1de4c1d3a55a921fc322ad0f39ef2c33c5f47cf1c3c939c71","leafIndex":"1","path":[{"hash":"707daa82ef564fd055e2f958f05f78d1a9f75cec05700cc8897ec471f7c53663","side":"left"},{"hash":"433ac293dc07fa907175e75567348b72af1497a06ba479de31c4a197ea480902","side":"right"},{"hash":"4e93e24678dc9c60ced9c74161d4dbc12259103a432465a7e3d1773039a4bef7","side":"right"},{"hash":"b3d38157a9a150679d3b9bc66985b68e6e377aadeeb0fc241cd93e81e3e91e3f","side":"right"},{"hash":"46ab0e92e398fb326acaa32ceecc6979e7c6c20308e7578e260c35f83d10d27f","side":"right"}]},{"eventId":"4e76b2c4-5d3e-4c95-904f-47f229e9e137","eventSequence":"3","leaf":"0a90764b782fef93b54026e7986b49296afcd1e43bb989be239df97f1b3e106e","leafIndex":"2","path":[{"hash":"f9a325a5d7c9654c4d75d184851e531ebdcc92c9eed9ea52c6e949e395efadc2","side":"right"},{"hash":"22ed630c8506eebb898eafd22bba1e22da5c8f91e476e35d2e6e1ae98e638924","side":"left"},{"hash":"4e93e24678dc9c60ced9c74161d4dbc12259103a432465a7e3d1773039a4bef7","side":"right"},{"hash":"b3d38157a9a150679d3b9bc66985b68e6e377aadeeb0fc241cd93e81e3e91e3f","side":"right"},{"hash":"46ab0e92e398fb326acaa32ceecc6979e7c6c20308e7578e260c35f83d10d27f","side":"right"}]},{"eventId":"5af2d80b-ad68-4656-a3f7-ce761006d901","eventSequence":"4","leaf":"f9a325a5d7c9654c4d75d184851e531ebdcc92c9eed9ea52c6e949e395efadc2","leafIndex":"3","path":[{"hash":"0a90764b782fef93b54026e7986b49296afcd1e43bb989be239df97f1b3e106e","side":"left"},{"hash":"22ed630c8506eebb898eafd22bba1e22da5c8f91e476e35d2e6e1ae98e638924","side":"left"},{"hash":"4e93e24678dc9c60ced9c74161d4dbc12259103a432465a7e3d1773039a4bef7","side":"right"},{"hash":"b3d38157a9a150679d3b9bc66985b68e6e377aadeeb0fc241cd93e81e3e91e3f","side":"right"},{"hash":"46ab0e92e398fb326acaa32ceecc6979e7c6c20308e7578e260c35f83d10d27f","side":"right"}]},{"eventId":"d2032e47-8ffe-43ac-9736-a52ff83adc41","eventSequence":"5","leaf":"eca19f8c6582a72d1b56e971b7af8df1ad3066d5e6b5ed37eaa6ec5bd8aaa6af","leafIndex":"4","path":[{"hash":"2156369288498bee00c47751fed352205365d91e20e5a48599fab677d89bb4d4","side":"right"},{"hash":"696014329355c482a7c39535acc6685ae75bcf22347ba7a8addd3ca96b0747ad","side":"right"},{"hash":"7d1087b2c8586cc3480454e7ac00807e1b8d1c7bd9887f8ff34423bdedbf836d","side":"left"},{"hash":"b3d38157a9a150679d3b9bc66985b68e6e377aadeeb0fc241cd93e81e3e91e3f","side":"right"},{"hash":"46ab0e92e398fb326acaa32ceecc6979e7c6c20308e7578e260c35f83d10d27f","side":"right"}]},{"eventId":"8349ac27-7a60-47ef-aee8-2c9a8db5dfbc","eventSequence":"6","leaf":"2156369288498bee00c47751fed352205365d91e20e5a48599fab677d89bb4d4","leafIndex":"5","path":[{"hash":"eca19f8c6582a72d1b56e971b7af8df1ad3066d5e6b5ed37eaa6ec5bd8aaa6af","side":"left"},{"hash":"696014329355c482a7c39535acc6685ae75bcf22347ba7a8addd3ca96b0747ad","side":"right"},{"hash":"7d1087b2c8586cc3480454e7ac00807e1b8d1c7bd9887f8ff34423bdedbf836d","side":"left"},{"hash":"b3d38157a9a150679d3b9bc66985b68e6e377aadeeb0fc241cd93e81e3e91e3f","side":"right"},{"hash":"46ab0e92e398fb326acaa32ceecc6979e7c6c20308e7578e260c35f83d10d27f","side":"right"}]},{"eventId":"36455089-40ae-43b3-aea7-7a42976432bb","eventSequence":"7","leaf":"dc3ad6cb28a2f4822323b2977d25766f55c2ddf73fe371fd1cf5ff3a64369cf0","leafIndex":"6","path":[{"hash":"24b7a034f3fe55be64684962737e8bad20e97d8049ac73cccc02822f952c3af9","side":"right"},{"hash":"77358a2d776ea1c4626c510d1c0627850e29794d961452972b92e2b8238432de","side":"left"},{"hash":"7d1087b2c8586cc3480454e7ac00807e1b8d1c7bd9887f8ff34423bdedbf836d","side":"left"},{"hash":"b3d38157a9a150679d3b9bc66985b68e6e377aadeeb0fc241cd93e81e3e91e3f","side":"right"},{"hash":"46ab0e92e398fb326acaa32ceecc6979e7c6c20308e7578e260c35f83d10d27f","side":"right"}]},{"eventId":"eca583ab-ab34-46b4-b5c7-ddbfbd58a2e6","eventSequence":"8","leaf":"24b7a034f3fe55be64684962737e8bad20e97d8049ac73cccc02822f952c3af9","leafIndex":"7","path":[{"hash":"dc3ad6cb28a2f4822323b2977d25766f55c2ddf73fe371fd1cf5ff3a64369cf0","side":"left"},{"hash":"77358a2d776ea1c4626c510d1c0627850e29794d961452972b92e2b8238432de","side":"left"},{"hash":"7d1087b2c8586cc3480454e7ac00807e1b8d1c7bd9887f8ff34423bdedbf836d","side":"left"},{"hash":"b3d38157a9a150679d3b9bc66985b68e6e377aadeeb0fc241cd93e81e3e91e3f","side":"right"},{"hash":"46ab0e92e398fb326acaa32ceecc6979e7c6c20308e7578e260c35f83d10d27f","side":"right"}]},{"eventId":"540e30eb-4399-4def-a123-d73533197fcf","eventSequence":"9","leaf":"c8e11017f8a35c8d9851ff95cc2c6a8055b680a939aa73ee685ad776f054df7b","leafIndex":"8","path":[{"hash":"2dc11eaa048861dff3841235d38016862736dec462bd7accf6296909c5ed80f9","side":"right"},{"hash":"f04408d4572e35d65f660b17401d3b10315483753a95e2570d464b85af5741e7","side":"right"},{"hash":"d8e86dded3a9395b70459208f164bf46720d6a14653f944c769e5acedbb64c28","side":"right"},{"hash":"681c3faaad9557783e251af7afef51f5db81599c5ed9dae99fbd329359d25644","side":"left"},{"hash":"46ab0e92e398fb326acaa32ceecc6979e7c6c20308e7578e260c35f83d10d27f","side":"right"}]},{"eventId":"7aadb1fe-36dc-484c-b8b0-c7daf1748c29","eventSequence":"10","leaf":"2dc11eaa048861dff3841235d38016862736dec462bd7accf6296909c5ed80f9","leafIndex":"9","path":[{"hash":"c8e11017f8a35c8d9851ff95cc2c6a8055b680a939aa73ee685ad776f054df7b","side":"left"},{"hash":"f04408d4572e35d65f660b17401d3b10315483753a95e2570d464b85af5741e7","side":"right"},{"hash":"d8e86dded3a9395b70459208f164bf46720d6a14653f944c769e5acedbb64c28","side":"right"},{"hash":"681c3faaad9557783e251af7afef51f5db81599c5ed9dae99fbd329359d25644","side":"left"},{"hash":"46ab0e92e398fb326acaa32ceecc6979e7c6c20308e7578e260c35f83d10d27f","side":"right"}]},{"eventId":"70fdef7a-5aae-430d-9728-5e0ea74d50b2","eventSequence":"11","leaf":"70fb9002493a9de56b4d3b21809d939077b19232acb195413fe7744be0b21110","leafIndex":"10","path":[{"hash":"c964a5ccb3b8fd560527574f6bccfadfc2d499dcea41ca6bdf885291270c5bd2","side":"right"},{"hash":"ef4d08185a966b23603124288ddd3834a25309c6a7aa16745bc6cc1110a702d8","side":"left"},{"hash":"d8e86dded3a9395b70459208f164bf46720d6a14653f944c769e5acedbb64c28","side":"right"},{"hash":"681c3faaad9557783e251af7afef51f5db81599c5ed9dae99fbd329359d25644","side":"left"},{"hash":"46ab0e92e398fb326acaa32ceecc6979e7c6c20308e7578e260c35f83d10d27f","side":"right"}]},{"eventId":"f680864d-464f-4860-a652-ad57a4318f5d","eventSequence":"12","leaf":"c964a5ccb3b8fd560527574f6bccfadfc2d499dcea41ca6bdf885291270c5bd2","leafIndex":"11","path":[{"hash":"70fb9002493a9de56b4d3b21809d939077b19232acb195413fe7744be0b21110","side":"left"},{"hash":"ef4d08185a966b23603124288ddd3834a25309c6a7aa16745bc6cc1110a702d8","side":"left"},{"hash":"d8e86dded3a9395b70459208f164bf46720d6a14653f944c769e5acedbb64c28","side":"right"},{"hash":"681c3faaad9557783e251af7afef51f5db81599c5ed9dae99fbd329359d25644","side":"left"},{"hash":"46ab0e92e398fb326acaa32ceecc6979e7c6c20308e7578e260c35f83d10d27f","side":"right"}]},{"eventId":"88f1d39c-a374-4b98-875f-e02cfe6c0c27","eventSequence":"13","leaf":"5e3370067e656bd41737882bd23f2f3d1c0de3fd3fdf0e7a60b64a7ce58681fe","leafIndex":"12","path":[{"hash":"696af6bebf7ee445c48c729d5b198e882ca170f49c9afdcecf62e392bb57d08c","side":"right"},{"hash":"2ef0a4d473bc0b2f87f5fe2733bd21aca4aac6633d1c1f0ef11ed0918fa82a18","side":"right"},{"hash":"54d3e64462b768978fa85744a00d0d621cbac844f81663aaf24d5a7b5f406426","side":"left"},{"hash":"681c3faaad9557783e251af7afef51f5db81599c5ed9dae99fbd329359d25644","side":"left"},{"hash":"46ab0e92e398fb326acaa32ceecc6979e7c6c20308e7578e260c35f83d10d27f","side":"right"}]},{"eventId":"590dcc7c-5092-45b3-85c8-6b34eb8fda3b","eventSequence":"14","leaf":"696af6bebf7ee445c48c729d5b198e882ca170f49c9afdcecf62e392bb57d08c","leafIndex":"13","path":[{"hash":"5e3370067e656bd41737882bd23f2f3d1c0de3fd3fdf0e7a60b64a7ce58681fe","side":"left"},{"hash":"2ef0a4d473bc0b2f87f5fe2733bd21aca4aac6633d1c1f0ef11ed0918fa82a18","side":"right"},{"hash":"54d3e64462b768978fa85744a00d0d621cbac844f81663aaf24d5a7b5f406426","side":"left"},{"hash":"681c3faaad9557783e251af7afef51f5db81599c5ed9dae99fbd329359d25644","side":"left"},{"hash":"46ab0e92e398fb326acaa32ceecc6979e7c6c20308e7578e260c35f83d10d27f","side":"right"}]},{"eventId":"8e139f24-648f-4846-8c3a-191d5cfe0ba6","eventSequence":"15","leaf":"4df6f048f3548e2822a6d524adfe2d56bacaf9bb3cf17aa05b8cf151a4d430e1","leafIndex":"14","path":[{"hash":"e88337fe9e430a4ce7772b28e54657bd52af94bc2b0380791d64fd02358b063a","side":"right"},{"hash":"c3417a0f0ed6e8a335e5928471175f1683082f01464bbef7e47fa08b503a3d12","side":"left"},{"hash":"54d3e64462b768978fa85744a00d0d621cbac844f81663aaf24d5a7b5f406426","side":"left"},{"hash":"681c3faaad9557783e251af7afef51f5db81599c5ed9dae99fbd329359d25644","side":"left"},{"hash":"46ab0e92e398fb326acaa32ceecc6979e7c6c20308e7578e260c35f83d10d27f","side":"right"}]},{"eventId":"9420f78f-e5c0-4f21-8ee8-8da4b789dedf","eventSequence":"16","leaf":"e88337fe9e430a4ce7772b28e54657bd52af94bc2b0380791d64fd02358b063a","leafIndex":"15","path":[{"hash":"4df6f048f3548e2822a6d524adfe2d56bacaf9bb3cf17aa05b8cf151a4d430e1","side":"left"},{"hash":"c3417a0f0ed6e8a335e5928471175f1683082f01464bbef7e47fa08b503a3d12","side":"left"},{"hash":"54d3e64462b768978fa85744a00d0d621cbac844f81663aaf24d5a7b5f406426","side":"left"},{"hash